Titre;Organisation;Url;StartDate;EndDate;Image;Description
Projet « Patients Portal »;Personnel;/projet/resume;Juin 2023 - Auj.;;Ce projet se veut être une interface web permettant aux patientes et patients d'alimenter leur dossier de santé avec leurs données personnelles, dont celles fournies par les appareils intelligents (montres, par exemple). Il a pour objectif de permettre aux patientes et patients de participer activement aux décisions de santé les concernant et de créer une base de données sur les données autorapportées. Les fondations de ce projet ont été réfléchies dans le contexte de __Deepmay__ où il fallait arriver avec un projet sur lequel travailler. Je suis évidemment arrivé au camp avec un projet sur une question de __Droits des patient·e·s__ qui poursuit en un sens le travail de mon mémoire de __Maîtrise en philosophie__ :  pourquoi ne pas mettre en place une manière de systématiser les données patients? En date d'aujourd'hui, ce projet a été accepté pour encadrement par l'équipe de la chaire <a href='https://vitam.ulaval.ca'>Vitam</a> et nécessitera vraisemblablement des compétences en __Programmation web__. Consultez le <a href='/projet/resume'>résumé</a> pour en apprendre davantage sur ce projet! 
Base de données d'articles de philosophie;Personnel;https://huggingface.co/datasets/mfgiguere/erudit-french-philosophy;Août 2023;deepmay.jpg;Lors de la formation __Deepmay__, j'ai montré une base de données composée de 537 934 entrées de phrases qui regroupent l'ensemble des publications de revues québécoises de philosophie. Pour se faire, j'ai programmé un web parser qui a recueilli tous les textes disponibles sur Érudits des revues de la catégorie « Philosophie ». Les textes étaient alors scindés en phrases et placés dans la base de données. L'objectif de cette base était de spécialiser un modèle de langage francophone à la philosophie, mais le temps d'entraîner le modèle était plus long que la formation Deepmay et le projet s'est donc arrêté à cette étape. La base de données est tout de même accessible sur <a href='https://huggingface.co/datasets/mfgiguere/erudit-french-philosophy'>Huggingface</a> pour quiconque aimerait poursuivre ce projet ou un autre. 
Logiciel de demandes de remboursement;FCAAP;;Juin 2023 - Auj.;fcaap.jpg;Dans le cadre de mon mandat à la __FCAAP__, il m'a été demandé de procéder à l'__Automatisation__ des processus de remboursements. Auparavant, les remboursements étaient traités manuellement par la direction. Avec ce logiciel que j'ai créé via PowerAutomate, l'attribution des budgets se fait automatiquement selon la demande. La direction doit tout de même valider que les factures sont présentes, mais n'a pas à calculer si la demande respecte les contraintes budgétaires (par ex. un maximum de 45$ par catégorie) puisque ces calculs sont automatiques. Cet outil est en évolution selon les demandes de la direction et est utilisé par une centaine de personnes. 
Base de données spécialisée sur la retraite;Observatoire de la retraite;https://recherche.observatoireretraite.ca/;Juil. 2022 - Auj.;observatoire.png;La <a href='https://recherche.observatoireretraite.ca'>base de données spécialisées sur la retraite</a> monté de pair avec l'équipe de recherche de l'__Observatoire de la retraite__ est un répertoire d'articles publiés par des revues spécialisées sur la retraite où il est possible de chercher en utilisant des mots-clefs. L'outil nécessite une connexion et n'est qu'utilisable que pour les partenaires de l'Observatoire. Pour que le logiciel fonctionne, il y un web parser qui recherche des textes sur des sites identifiés par l'équipe de recherche. Les textes bruts sont placés dans une base de données SQLite puis certaines modifications sont faites pour qu'ils soient facilement utilisables pour l'interface de recherche. Les textes modifiés sont alors envoyés dans la base MySQL sur lequel est connecté l'interface web. Pour ce projet, j'ai été en charge de la programmation du web parser et du script de modifications des textes ainsi que de la __Programmation web__ de l'interface et de son hébergement. 
Tableaux de bord régionaux;CSSSPNQL;;Juin 2022 - Mars 2023;CSSSPNQL.svg;Dans le cadre de mon mandat à la __CSSSPNQL__, je collaborais avec les directions des centres de santé pour faire l'__Analyse de données__ sur les activités médicales dans leur établissement. Même si je collaborais avec différents établissements, les besoins en données étaient similaires. La programmation de tableaux de bord régionaux a donc été l'avenue privilégiée pour répondre à leurs besoins. Ces tableaux de bord étaient connectés sur les données générées par le dossier médical électronique et permettait de visualiser des données comme le nombre d'interventions effectuées par programmes (Soins à domicile, première ligne, etc.), le pourcentage de la population vaccinée, le nombre d'interventions faites par mois en lien avec le diabète, etc. Ces tableaux de bord ont été programmés via le logiciel Sisense et distribués à tous les centres de santé, et des séances de __Formation__ avaient été organisés pour discuter de l'interprétation de ces tableaux de bord. 
Connexion à l'API Strava;Personnel;https://github.com/MFGiguere/Various_projects/tree/main/Strava_stats_GIT;Mars 2021 – Auj.;tri.png;J'aime m'entraîner, mais j'aime aussi les chiffres! J'ai donc mobiliser mon expertise en __Analyse de données__ pour créer un programme dans R permettrant de mettre en graphique mes activités sportives. Le programme se connecte à l'API de Strava et me permet de suivre mon évolution dans le sport! On retrouve d'ailleurs sur <a href='https://github.com/MFGiguere/Various_projects/tree/main/Strava_stats_GIT'>Github</a> le programme pour quiconque aimerait l'utiliser. 